<?xml version="1.0" encoding="UTF-8" ?>
<!ELEMENT TestSuitesLibrary ( TestSuites) >
<!ATTLIST TestSuitesLibrary name CDATA #REQUIRED>
<!ATTLIST TestSuitesLibrary title CDATA #REQUIRED>
<!ELEMENT TestSuites ( TestSuite+ ) >
<!ELEMENT TestSuite ( Description, TestCases+ ) >
<!ATTLIST TestSuite name CDATA #REQUIRED>
<!ATTLIST TestSuite title CDATA #REQUIRED>
<!ATTLIST TestSuite group CDATA #IMPLIED>
<!ELEMENT Description (#PCDATA) >
<!ELEMENT TestCases ( TestCase+ ) >
<!ELEMENT TestCase ( Description, Rationale, Inject?, Dependencies?, Tests ) >
<!ATTLIST TestCase name CDATA #REQUIRED>
<!ATTLIST TestCase title CDATA #REQUIRED>
<!ATTLIST TestCase benchmark CDATA #REQUIRED>
<!ATTLIST TestCase id CDATA #REQUIRED>
<!ELEMENT Rationale ( Description ) >
<!ATTLIST Rationale severity CDATA #REQUIRED>
<!ATTLIST Rationale minimum_health CDATA #REQUIRED>
<!ATTLIST Rationale responsible CDATA #REQUIRED>
<!ELEMENT Dependencies ( Dependency+ ) >
<!ELEMENT Dependency EMPTY >
<!ATTLIST Dependency name CDATA #REQUIRED>
<!ATTLIST Dependency title CDATA #REQUIRED>
<!ATTLIST Dependency testsuite CDATA #REQUIRED>
<!ATTLIST Dependency type CDATA #REQUIRED>
<!ELEMENT Tests ( Test+ ) >
<!ELEMENT Test ( TestSteps, Parameters ) >
<!ATTLIST Test name CDATA #REQUIRED>
<!ATTLIST Test title CDATA #REQUIRED>
<!ELEMENT TestSteps ( TestStep+ ) >
<!ELEMENT TestStep EMPTY >
<!ATTLIST TestStep id CDATA #REQUIRED>
<!ATTLIST TestStep src_ip CDATA #IMPLIED>
<!ATTLIST TestStep dst_ip CDATA #IMPLIED>
<!ATTLIST TestStep protocol CDATA #IMPLIED>
<!ATTLIST TestStep port CDATA #IMPLIED>
<!ATTLIST TestStep description CDATA #IMPLIED>
<!ELEMENT Inject ( Classes ) >
<!ELEMENT Classes ( Class+) >
<!ELEMENT Class ( #PCDATA) >
<!ELEMENT Parameters ( Parameter+ ) >
<!ELEMENT Parameter EMPTY >
<!ATTLIST Parameter name CDATA #REQUIRED>
<!ATTLIST Parameter engine CDATA #REQUIRED>
<!ATTLIST Parameter source CDATA #REQUIRED>
<!ATTLIST Parameter query CDATA #REQUIRED>
