<?xml version="1.0"?>
<!DOCTYPE TestSuitesLibrary SYSTEM "dtd/testsuiteslibrary.dtd">
<?xml-stylesheet type="text/xsl" href="xsl/testsuiteslibrary.xsl"?>
<TestSuitesLibrary name="unix" title="UNIX test library">
  <TestSuites>
    <TestSuite name="connectivity" title="Connectivity">
      <Description> bla bla bla</Description>
        <TestCases> 
          <TestCase id="000000" title="LDAP Servers Reachability" name="reachability-ldap" benchmark="checkconn">
          <Description>Perform basic connectivity test of LDAP servers</Description>
          <Rationale severity="Critical" minimum_health="66%" responsible="Telecom Group">
            <Description>LDAP servers should be reachable to allow users authentication and authorization</Description>
          </Rationale>
          <Inject>
            <Classes>
              <Class>LDAP Client</Class>
            </Classes>
          </Inject>
          <Dependencies>
            <Dependency type="testcase" name="testcasename" testsuite="testsuitename" title="Testcase" />  
          </Dependencies>
          <Tests>
            <Test title="Reachability" name="reachability">
              <TestSteps> 
                <TestStep id="${OITA}" src_ip="${SRC_IP}" dst_ip="${DST_IP}" protocol="${PROTOCOL}" port="${PORT}" /> 
              </TestSteps>
              <Parameters>
                 <Parameter name="SRC_IP" engine="SELF" source="variables" query="${TARGET_HOST}" />
                 <Parameter name="DST_IP" engine="XPATH" source="topology.xml" query="/Topology/Server[${TARGET_HOST}]/Peers[@port=389,@port=636]/@ip" />
                 <Parameter name="PORT" engine="XPATH" source="topology.xml" query="/Topology/Server[${TARGET_HOST}]/Peers[@port=389,@port=636]/@port" />
                 <Parameter name="PROTOCOL" engine="XPATH" source="topology.xml" query="/Topology/Server[${TARGET_HOST}]/Peers[@port=389,@port=636]/@protocol" />
              </Parameters> 
            </Test>         
          </Tests>      
        </TestCase> 
      </TestCases>
    </TestSuite>
  </TestSuites>
</TestSuitesLibrary>
